15:44:27.236316 IP 10.0.0.2 > 10.0.0.4: ICMP echo request, id 21158, seq 12, length 64
15:44:27.236353 IP 10.0.0.4 > 10.0.0.2: ICMP echo reply, id 21158, seq 12, length 64
15:44:28.260321 IP 10.0.0.2 > 10.0.0.4: ICMP echo request, id 21158, seq 13, length 64
15:44:28.260357 IP 10.0.0.4 > 10.0.0.2: ICMP echo reply, id 21158, seq 13, length 64
15:44:29.284366 IP 10.0.0.2 > 10.0.0.4: ICMP echo request, id 21158, seq 14, length 64
15:44:29.284402 IP 10.0.0.4 > 10.0.0.2: ICMP echo reply, id 21158, seq 14, length 64
15:44:30.308322 IP 10.0.0.2 > 10.0.0.4: ICMP echo request, id 21158, seq 15, length 64
15:44:30.308359 IP 10.0.0.4 > 10.0.0.2: ICMP echo reply, id 21158, seq 15, length 64
15:44:31.332334 IP 10.0.0.2 > 10.0.0.4: ICMP echo request, id 21158, seq 16, length 64
15:44:31.332370 IP 10.0.0.4 > 10.0.0.2: ICMP echo reply, id 21158, seq 16, length 64
15:44:32.356245 IP 10.0.0.2 > 10.0.0.4: ICMP echo request, id 21158, seq 17, length 64
15:44:32.356282 IP 10.0.0.4 > 10.0.0.2: ICMP echo reply, id 21158, seq 17, length 64
15:44:33.380254 IP 10.0.0.2 > 10.0.0.4: ICMP echo request, id 21158, seq 18, length 64
15:44:33.380289 IP 10.0.0.4 > 10.0.0.2: ICMP echo reply, id 21158, seq 18, length 64
15:44:34.404317 IP 10.0.0.2 > 10.0.0.4: ICMP echo request, id 21158, seq 19, length 64
15:44:34.404353 IP 10.0.0.4 > 10.0.0.2: ICMP echo reply, id 21158, seq 19, length 64
15:44:35.428302 IP 10.0.0.2 > 10.0.0.4: ICMP echo request, id 21158, seq 20, length 64
15:44:35.428335 IP 10.0.0.4 > 10.0.0.2: ICMP echo reply, id 21158, seq 20, length 64
15:44:36.452166 IP 10.0.0.2 > 10.0.0.4: ICMP echo request, id 21158, seq 21, length 64
15:44:36.452181 IP 10.0.0.4 > 10.0.0.2: ICMP echo reply, id 21158, seq 21, length 64
15:44:37.476349 IP 10.0.0.2 > 10.0.0.4: ICMP echo request, id 21158, seq 22, length 64
15:44:37.476386 IP 10.0.0.4 > 10.0.0.2: ICMP echo reply, id 21158, seq 22, length 64
15:44:38.500214 IP 10.0.0.2 > 10.0.0.4: ICMP echo request, id 21158, seq 23, length 64
15:44:38.500249 IP 10.0.0.4 > 10.0.0.2: ICMP echo reply, id 21158, seq 23, length 64
15:44:39.524245 IP 10.0.0.2 > 10.0.0.4: ICMP echo request, id 21158, seq 24, length 64
15:44:39.524281 IP 10.0.0.4 > 10.0.0.2: ICMP echo reply, id 21158, seq 24, length 64
15:44:40.548379 IP 10.0.0.2 > 10.0.0.4: ICMP echo request, id 21158, seq 25, length 64
15:44:40.548415 IP 10.0.0.4 > 10.0.0.2: ICMP echo reply, id 21158, seq 25, length 64
15:44:41.572357 IP 10.0.0.2 > 10.0.0.4: ICMP echo request, id 21158, seq 26, length 64
15:44:41.572393 IP 10.0.0.4 > 10.0.0.2: ICMP echo reply, id 21158, seq 26, length 64
15:44:42.596220 IP 10.0.0.2 > 10.0.0.4: ICMP echo request, id 21158, seq 27, length 64
15:44:42.596256 IP 10.0.0.4 > 10.0.0.2: ICMP echo reply, id 21158, seq 27, length 64
15:44:43.620285 IP 10.0.0.2 > 10.0.0.4: ICMP echo request, id 21158, seq 28, length 64
15:44:43.620321 IP 10.0.0.4 > 10.0.0.2: ICMP echo reply, id 21158, seq 28, length 64
15:44:44.644165 IP 10.0.0.2 > 10.0.0.4: ICMP echo request, id 21158, seq 29, length 64
15:44:44.644203 IP 10.0.0.4 > 10.0.0.2: ICMP echo reply, id 21158, seq 29, length 64
15:44:45.668232 IP 10.0.0.2 > 10.0.0.4: ICMP echo request, id 21158, seq 30, length 64
15:44:45.668268 IP 10.0.0.4 > 10.0.0.2: ICMP echo reply, id 21158, seq 30, length 64
15:44:46.692302 IP 10.0.0.2 > 10.0.0.4: ICMP echo request, id 21158, seq 31, length 64
15:44:46.692338 IP 10.0.0.4 > 10.0.0.2: ICMP echo reply, id 21158, seq 31, length 64
15:44:47.716247 IP 10.0.0.2 > 10.0.0.4: ICMP echo request, id 21158, seq 32, length 64
15:44:47.716284 IP 10.0.0.4 > 10.0.0.2: ICMP echo reply, id 21158, seq 32, length 64
15:44:48.740363 IP 10.0.0.2 > 10.0.0.4: ICMP echo request, id 21158, seq 33, length 64
15:44:48.740399 IP 10.0.0.4 > 10.0.0.2: ICMP echo reply, id 21158, seq 33, length 64
15:44:49.764368 IP 10.0.0.2 > 10.0.0.4: ICMP echo request, id 21158, seq 34, length 64
15:44:49.764405 IP 10.0.0.4 > 10.0.0.2: ICMP echo reply, id 21158, seq 34, length 64
15:44:50.788243 IP 10.0.0.2 > 10.0.0.4: ICMP echo request, id 21158, seq 35, length 64
15:44:50.788279 IP 10.0.0.4 > 10.0.0.2: ICMP echo reply, id 21158, seq 35, length 64
15:44:51.812362 IP 10.0.0.2 > 10.0.0.4: ICMP echo request, id 21158, seq 36, length 64
15:44:51.812398 IP 10.0.0.4 > 10.0.0.2: ICMP echo reply, id 21158, seq 36, length 64
15:44:52.836388 IP 10.0.0.2 > 10.0.0.4: ICMP echo request, id 21158, seq 37, length 64
15:44:52.836427 IP 10.0.0.4 > 10.0.0.2: ICMP echo reply, id 21158, seq 37, length 64
15:44:53.860179 IP 10.0.0.2 > 10.0.0.4: ICMP echo request, id 21158, seq 38, length 64
15:44:53.860216 IP 10.0.0.4 > 10.0.0.2: ICMP echo reply, id 21158, seq 38, length 64
15:44:54.884345 IP 10.0.0.2 > 10.0.0.4: ICMP echo request, id 21158, seq 39, length 64
15:44:54.884381 IP 10.0.0.4 > 10.0.0.2: ICMP echo reply, id 21158, seq 39, length 64
15:44:55.908364 IP 10.0.0.2 > 10.0.0.4: ICMP echo request, id 21158, seq 40, length 64
15:44:55.908400 IP 10.0.0.4 > 10.0.0.2: ICMP echo reply, id 21158, seq 40, length 64
15:44:56.932308 IP 10.0.0.2 > 10.0.0.4: ICMP echo request, id 21158, seq 41, length 64
15:44:56.932345 IP 10.0.0.4 > 10.0.0.2: ICMP echo reply, id 21158, seq 41, length 64
15:44:57.892415 ARP, Request who-has 10.0.0.2 tell 10.0.0.4, length 28
15:44:57.892642 ARP, Reply 10.0.0.2 is-at a6:aa:09:9c:ee:7e, length 28
15:44:57.956212 IP 10.0.0.2 > 10.0.0.4: ICMP echo request, id 21158, seq 42, length 64
15:44:57.956248 IP 10.0.0.4 > 10.0.0.2: ICMP echo reply, id 21158, seq 42, length 64
15:44:58.980364 IP 10.0.0.2 > 10.0.0.4: ICMP echo request, id 21158, seq 43, length 64
15:44:58.980399 IP 10.0.0.4 > 10.0.0.2: ICMP echo reply, id 21158, seq 43, length 64
15:45:00.004345 IP 10.0.0.2 > 10.0.0.4: ICMP echo request, id 21158, seq 44, length 64
15:45:00.004382 IP 10.0.0.4 > 10.0.0.2: ICMP echo reply, id 21158, seq 44, length 64
15:45:01.028243 IP 10.0.0.2 > 10.0.0.4: ICMP echo request, id 21158, seq 45, length 64
15:45:01.028280 IP 10.0.0.4 > 10.0.0.2: ICMP echo reply, id 21158, seq 45, length 64
15:45:02.052318 IP 10.0.0.2 > 10.0.0.4: ICMP echo request, id 21158, seq 46, length 64
15:45:02.052355 IP 10.0.0.4 > 10.0.0.2: ICMP echo reply, id 21158, seq 46, length 64
15:45:03.076222 IP 10.0.0.2 > 10.0.0.4: ICMP echo request, id 21158, seq 47, length 64
15:45:03.076259 IP 10.0.0.4 > 10.0.0.2: ICMP echo reply, id 21158, seq 47, length 64
15:45:04.100260 IP 10.0.0.2 > 10.0.0.4: ICMP echo request, id 21158, seq 48, length 64
15:45:04.100296 IP 10.0.0.4 > 10.0.0.2: ICMP echo reply, id 21158, seq 48, length 64
15:45:05.124285 IP 10.0.0.2 > 10.0.0.4: ICMP echo request, id 21158, seq 49, length 64
15:45:05.124322 IP 10.0.0.4 > 10.0.0.2: ICMP echo reply, id 21158, seq 49, length 64
15:45:06.148244 IP 10.0.0.2 > 10.0.0.4: ICMP echo request, id 21158, seq 50, length 64
15:45:06.148281 IP 10.0.0.4 > 10.0.0.2: ICMP echo reply, id 21158, seq 50, length 64
15:45:07.172215 IP 10.0.0.2 > 10.0.0.4: ICMP echo request, id 21158, seq 51, length 64
15:45:07.172252 IP 10.0.0.4 > 10.0.0.2: ICMP echo reply, id 21158, seq 51, length 64
15:45:08.196343 IP 10.0.0.2 > 10.0.0.4: ICMP echo request, id 21158, seq 52, length 64
15:45:08.196379 IP 10.0.0.4 > 10.0.0.2: ICMP echo reply, id 21158, seq 52, length 64
15:45:09.220244 IP 10.0.0.2 > 10.0.0.4: ICMP echo request, id 21158, seq 53, length 64
15:45:09.220279 IP 10.0.0.4 > 10.0.0.2: ICMP echo reply, id 21158, seq 53, length 64
15:45:10.244254 IP 10.0.0.2 > 10.0.0.4: ICMP echo request, id 21158, seq 54, length 64
15:45:10.244290 IP 10.0.0.4 > 10.0.0.2: ICMP echo reply, id 21158, seq 54, length 64
15:45:11.268355 IP 10.0.0.2 > 10.0.0.4: ICMP echo request, id 21158, seq 55, length 64
15:45:11.268392 IP 10.0.0.4 > 10.0.0.2: ICMP echo reply, id 21158, seq 55, length 64
15:45:12.292327 IP 10.0.0.2 > 10.0.0.4: ICMP echo request, id 21158, seq 56, length 64
15:45:12.292362 IP 10.0.0.4 > 10.0.0.2: ICMP echo reply, id 21158, seq 56, length 64
15:45:13.316229 IP 10.0.0.2 > 10.0.0.4: ICMP echo request, id 21158, seq 57, length 64
15:45:13.316275 IP 10.0.0.4 > 10.0.0.2: ICMP echo reply, id 21158, seq 57, length 64
15:45:14.340182 IP 10.0.0.2 > 10.0.0.4: ICMP echo request, id 21158, seq 58, length 64
15:45:14.340217 IP 10.0.0.4 > 10.0.0.2: ICMP echo reply, id 21158, seq 58, length 64
15:45:15.364312 IP 10.0.0.2 > 10.0.0.4: ICMP echo request, id 21158, seq 59, length 64
15:45:15.364348 IP 10.0.0.4 > 10.0.0.2: ICMP echo reply, id 21158, seq 59, length 64

