14:10:03.431394 LLDP, length 71: openflow:4
14:10:03.431503 LLDP, length 71: openflow:1
14:10:03.431567 LLDP, length 71: openflow:3
14:10:03.615509 IP 10.0.0.1 > 10.0.0.2: ICMP echo request, id 27699, seq 41, length 64
14:10:03.615524 IP 10.0.0.2 > 10.0.0.1: ICMP echo reply, id 27699, seq 41, length 64
14:10:03.615537 IP 10.0.0.2 > 10.0.0.1: ICMP echo reply, id 27699, seq 41, length 64
14:10:04.639394 IP 10.0.0.1 > 10.0.0.2: ICMP echo request, id 27699, seq 42, length 64
14:10:04.639407 IP 10.0.0.2 > 10.0.0.1: ICMP echo reply, id 27699, seq 42, length 64
14:10:04.639418 IP 10.0.0.2 > 10.0.0.1: ICMP echo reply, id 27699, seq 42, length 64
14:10:05.663422 IP 10.0.0.1 > 10.0.0.2: ICMP echo request, id 27699, seq 43, length 64
14:10:05.663434 IP 10.0.0.2 > 10.0.0.1: ICMP echo reply, id 27699, seq 43, length 64
14:10:05.663446 IP 10.0.0.2 > 10.0.0.1: ICMP echo reply, id 27699, seq 43, length 64
14:10:06.687418 IP 10.0.0.1 > 10.0.0.2: ICMP echo request, id 27699, seq 44, length 64
14:10:06.687432 IP 10.0.0.2 > 10.0.0.1: ICMP echo reply, id 27699, seq 44, length 64
14:10:06.687443 IP 10.0.0.2 > 10.0.0.1: ICMP echo reply, id 27699, seq 44, length 64
14:10:07.711415 IP 10.0.0.1 > 10.0.0.2: ICMP echo request, id 27699, seq 45, length 64
14:10:07.711428 IP 10.0.0.2 > 10.0.0.1: ICMP echo reply, id 27699, seq 45, length 64
14:10:07.711439 IP 10.0.0.2 > 10.0.0.1: ICMP echo reply, id 27699, seq 45, length 64
14:10:08.431346 LLDP, length 71: openflow:4
14:10:08.431441 LLDP, length 71: openflow:1
14:10:08.431493 LLDP, length 71: openflow:3
14:10:08.735422 IP 10.0.0.1 > 10.0.0.2: ICMP echo request, id 27699, seq 46, length 64
14:10:08.735436 IP 10.0.0.2 > 10.0.0.1: ICMP echo reply, id 27699, seq 46, length 64
14:10:08.735447 IP 10.0.0.2 > 10.0.0.1: ICMP echo reply, id 27699, seq 46, length 64
14:10:09.759402 IP 10.0.0.1 > 10.0.0.2: ICMP echo request, id 27699, seq 47, length 64
14:10:09.759416 IP 10.0.0.2 > 10.0.0.1: ICMP echo reply, id 27699, seq 47, length 64
14:10:09.759431 IP 10.0.0.2 > 10.0.0.1: ICMP echo reply, id 27699, seq 47, length 64
14:10:10.783413 IP 10.0.0.1 > 10.0.0.2: ICMP echo request, id 27699, seq 48, length 64
14:10:10.783427 IP 10.0.0.2 > 10.0.0.1: ICMP echo reply, id 27699, seq 48, length 64
14:10:10.783438 IP 10.0.0.2 > 10.0.0.1: ICMP echo reply, id 27699, seq 48, length 64
14:10:11.807391 IP 10.0.0.1 > 10.0.0.2: ICMP echo request, id 27699, seq 49, length 64
14:10:11.807404 IP 10.0.0.2 > 10.0.0.1: ICMP echo reply, id 27699, seq 49, length 64
14:10:11.807416 IP 10.0.0.2 > 10.0.0.1: ICMP echo reply, id 27699, seq 49, length 64
14:10:12.831440 IP 10.0.0.1 > 10.0.0.2: ICMP echo request, id 27699, seq 50, length 64
14:10:12.831459 IP 10.0.0.2 > 10.0.0.1: ICMP echo reply, id 27699, seq 50, length 64
14:10:12.831475 IP 10.0.0.2 > 10.0.0.1: ICMP echo reply, id 27699, seq 50, length 64
14:10:13.431402 LLDP, length 71: openflow:4
14:10:13.431444 LLDP, length 71: openflow:1
14:10:13.431485 LLDP, length 71: openflow:3
14:10:13.855407 IP 10.0.0.1 > 10.0.0.2: ICMP echo request, id 27699, seq 51, length 64
14:10:13.855432 IP 10.0.0.2 > 10.0.0.1: ICMP echo reply, id 27699, seq 51, length 64
14:10:13.855453 IP 10.0.0.2 > 10.0.0.1: ICMP echo reply, id 27699, seq 51, length 64
14:10:14.879404 IP 10.0.0.1 > 10.0.0.2: ICMP echo request, id 27699, seq 52, length 64
14:10:14.879415 IP 10.0.0.2 > 10.0.0.1: ICMP echo reply, id 27699, seq 52, length 64
14:10:14.879439 IP 10.0.0.2 > 10.0.0.1: ICMP echo reply, id 27699, seq 52, length 64
14:10:15.903427 IP 10.0.0.1 > 10.0.0.2: ICMP echo request, id 27699, seq 53, length 64
14:10:15.903454 IP 10.0.0.2 > 10.0.0.1: ICMP echo reply, id 27699, seq 53, length 64
14:10:15.903469 IP 10.0.0.2 > 10.0.0.1: ICMP echo reply, id 27699, seq 53, length 64
14:10:16.931440 IP 10.0.0.1 > 10.0.0.2: ICMP echo request, id 27699, seq 54, length 64
14:10:16.931454 IP 10.0.0.2 > 10.0.0.1: ICMP echo reply, id 27699, seq 54, length 64
14:10:16.931465 IP 10.0.0.2 > 10.0.0.1: ICMP echo reply, id 27699, seq 54, length 64
14:10:17.951424 IP 10.0.0.1 > 10.0.0.2: ICMP echo request, id 27699, seq 55, length 64
14:10:17.951450 IP 10.0.0.2 > 10.0.0.1: ICMP echo reply, id 27699, seq 55, length 64
14:10:17.951461 IP 10.0.0.2 > 10.0.0.1: ICMP echo reply, id 27699, seq 55, length 64
14:10:18.431547 LLDP, length 71: openflow:4
14:10:18.431634 LLDP, length 71: openflow:1
14:10:18.431695 LLDP, length 71: openflow:3
14:10:18.975419 IP 10.0.0.1 > 10.0.0.2: ICMP echo request, id 27699, seq 56, length 64
14:10:18.975435 IP 10.0.0.2 > 10.0.0.1: ICMP echo reply, id 27699, seq 56, length 64
14:10:18.975453 IP 10.0.0.2 > 10.0.0.1: ICMP echo reply, id 27699, seq 56, length 64
14:10:19.999403 IP 10.0.0.1 > 10.0.0.2: ICMP echo request, id 27699, seq 57, length 64
14:10:19.999420 IP 10.0.0.2 > 10.0.0.1: ICMP echo reply, id 27699, seq 57, length 64
14:10:19.999434 IP 10.0.0.2 > 10.0.0.1: ICMP echo reply, id 27699, seq 57, length 64
14:10:21.023414 IP 10.0.0.1 > 10.0.0.2: ICMP echo request, id 27699, seq 58, length 64
14:10:21.023428 IP 10.0.0.2 > 10.0.0.1: ICMP echo reply, id 27699, seq 58, length 64
14:10:21.023438 IP 10.0.0.2 > 10.0.0.1: ICMP echo reply, id 27699, seq 58, length 64
14:10:22.047420 IP 10.0.0.1 > 10.0.0.2: ICMP echo request, id 27699, seq 59, length 64
14:10:22.047433 IP 10.0.0.2 > 10.0.0.1: ICMP echo reply, id 27699, seq 59, length 64
14:10:22.047445 IP 10.0.0.2 > 10.0.0.1: ICMP echo reply, id 27699, seq 59, length 64
14:10:23.071425 IP 10.0.0.1 > 10.0.0.2: ICMP echo request, id 27699, seq 60, length 64
14:10:23.071440 IP 10.0.0.2 > 10.0.0.1: ICMP echo reply, id 27699, seq 60, length 64
14:10:23.071453 IP 10.0.0.2 > 10.0.0.1: ICMP echo reply, id 27699, seq 60, length 64
14:10:23.431304 LLDP, length 71: openflow:4
14:10:23.431507 LLDP, length 71: openflow:3
14:10:23.431524 LLDP, length 71: openflow:1
14:10:24.095402 IP 10.0.0.1 > 10.0.0.2: ICMP echo request, id 27699, seq 61, length 64
14:10:24.095414 IP 10.0.0.2 > 10.0.0.1: ICMP echo reply, id 27699, seq 61, length 64
14:10:24.095426 IP 10.0.0.2 > 10.0.0.1: ICMP echo reply, id 27699, seq 61, length 64
14:10:25.119438 IP 10.0.0.1 > 10.0.0.2: ICMP echo request, id 27699, seq 62, length 64
14:10:25.119454 IP 10.0.0.2 > 10.0.0.1: ICMP echo reply, id 27699, seq 62, length 64
14:10:25.119468 IP 10.0.0.2 > 10.0.0.1: ICMP echo reply, id 27699, seq 62, length 64
14:10:26.143422 IP 10.0.0.1 > 10.0.0.2: ICMP echo request, id 27699, seq 63, length 64
14:10:26.143435 IP 10.0.0.2 > 10.0.0.1: ICMP echo reply, id 27699, seq 63, length 64
14:10:26.143447 IP 10.0.0.2 > 10.0.0.1: ICMP echo reply, id 27699, seq 63, length 64
14:10:27.167462 IP 10.0.0.1 > 10.0.0.2: ICMP echo request, id 27699, seq 64, length 64
14:10:27.167501 IP 10.0.0.2 > 10.0.0.1: ICMP echo reply, id 27699, seq 64, length 64
14:10:27.167534 IP 10.0.0.2 > 10.0.0.1: ICMP echo reply, id 27699, seq 64, length 64
14:10:28.191414 IP 10.0.0.1 > 10.0.0.2: ICMP echo request, id 27699, seq 65, length 64
14:10:28.191427 IP 10.0.0.2 > 10.0.0.1: ICMP echo reply, id 27699, seq 65, length 64
14:10:28.191438 IP 10.0.0.2 > 10.0.0.1: ICMP echo reply, id 27699, seq 65, length 64
14:10:28.431493 LLDP, length 71: openflow:4
14:10:28.431620 LLDP, length 71: openflow:1
14:10:28.431723 LLDP, length 71: openflow:3
14:10:29.215411 IP 10.0.0.1 > 10.0.0.2: ICMP echo request, id 27699, seq 66, length 64
14:10:29.215426 IP 10.0.0.2 > 10.0.0.1: ICMP echo reply, id 27699, seq 66, length 64
14:10:29.215438 IP 10.0.0.2 > 10.0.0.1: ICMP echo reply, id 27699, seq 66, length 64
14:10:30.239397 IP 10.0.0.1 > 10.0.0.2: ICMP echo request, id 27699, seq 67, length 64
14:10:30.239412 IP 10.0.0.2 > 10.0.0.1: ICMP echo reply, id 27699, seq 67, length 64
14:10:30.239425 IP 10.0.0.2 > 10.0.0.1: ICMP echo reply, id 27699, seq 67, length 64
14:10:31.263417 IP 10.0.0.1 > 10.0.0.2: ICMP echo request, id 27699, seq 68, length 64
14:10:31.263430 IP 10.0.0.2 > 10.0.0.1: ICMP echo reply, id 27699, seq 68, length 64
14:10:31.263441 IP 10.0.0.2 > 10.0.0.1: ICMP echo reply, id 27699, seq 68, length 64
14:10:32.287411 IP 10.0.0.1 > 10.0.0.2: ICMP echo request, id 27699, seq 69, length 64
14:10:32.287429 IP 10.0.0.2 > 10.0.0.1: ICMP echo reply, id 27699, seq 69, length 64
14:10:32.287445 IP 10.0.0.2 > 10.0.0.1: ICMP echo reply, id 27699, seq 69, length 64
14:10:32.415366 ARP, Request who-has 10.0.0.1 tell 10.0.0.2, length 28
14:10:32.415678 ARP, Request who-has 10.0.0.1 tell 10.0.0.2, length 28
14:10:32.415708 ARP, Reply 10.0.0.1 is-at 00:00:00:00:00:01, length 28
14:10:33.311466 IP 10.0.0.1 > 10.0.0.2: ICMP echo request, id 27699, seq 70, length 64
14:10:33.311482 IP 10.0.0.2 > 10.0.0.1: ICMP echo reply, id 27699, seq 70, length 64
14:10:33.311509 IP 10.0.0.2 > 10.0.0.1: ICMP echo reply, id 27699, seq 70, length 64
14:10:33.431487 LLDP, length 71: openflow:4
14:10:33.431605 LLDP, length 71: openflow:1
14:10:33.431653 LLDP, length 71: openflow:3
14:10:34.335430 IP 10.0.0.1 > 10.0.0.2: ICMP echo request, id 27699, seq 71, length 64
14:10:34.335456 IP 10.0.0.2 > 10.0.0.1: ICMP echo reply, id 27699, seq 71, length 64
14:10:34.335467 IP 10.0.0.2 > 10.0.0.1: ICMP echo reply, id 27699, seq 71, length 64
14:10:35.359419 IP 10.0.0.1 > 10.0.0.2: ICMP echo request, id 27699, seq 72, length 64
14:10:35.359432 IP 10.0.0.2 > 10.0.0.1: ICMP echo reply, id 27699, seq 72, length 64
14:10:35.359444 IP 10.0.0.2 > 10.0.0.1: ICMP echo reply, id 27699, seq 72, length 64
14:10:36.383404 IP 10.0.0.1 > 10.0.0.2: ICMP echo request, id 27699, seq 73, length 64
14:10:36.383419 IP 10.0.0.2 > 10.0.0.1: ICMP echo reply, id 27699, seq 73, length 64
14:10:36.383435 IP 10.0.0.2 > 10.0.0.1: ICMP echo reply, id 27699, seq 73, length 64
14:10:37.407392 IP 10.0.0.1 > 10.0.0.2: ICMP echo request, id 27699, seq 74, length 64
14:10:37.407406 IP 10.0.0.2 > 10.0.0.1: ICMP echo reply, id 27699, seq 74, length 64
14:10:37.407417 IP 10.0.0.2 > 10.0.0.1: ICMP echo reply, id 27699, seq 74, length 64
14:10:38.431469 LLDP, length 71: openflow:4
14:10:38.431562 LLDP, length 71: openflow:1
14:10:38.431631 LLDP, length 71: openflow:3

