11:08:56.853252 LLDP, length 71: openflow:1
11:08:57.849295 IP 10.0.0.1 > 10.0.0.2: ICMP echo request, id 3592, seq 1, length 64
11:08:57.849658 IP 10.0.0.2 > 10.0.0.1: ICMP echo reply, id 3592, seq 1, length 64
11:08:57.849668 IP 10.0.0.2 > 10.0.0.1: ICMP echo reply, id 3592, seq 1, length 64
11:08:57.849672 IP 10.0.0.2 > 10.0.0.1: ICMP echo reply, id 3592, seq 1, length 64
11:08:57.849675 IP 10.0.0.2 > 10.0.0.1: ICMP echo reply, id 3592, seq 1, length 64
11:08:58.867339 IP 10.0.0.1 > 10.0.0.2: ICMP echo request, id 3592, seq 2, length 64
11:08:58.867393 IP 10.0.0.2 > 10.0.0.1: ICMP echo reply, id 3592, seq 2, length 64
11:08:58.867396 IP 10.0.0.2 > 10.0.0.1: ICMP echo reply, id 3592, seq 2, length 64
11:08:58.867398 IP 10.0.0.2 > 10.0.0.1: ICMP echo reply, id 3592, seq 2, length 64
11:08:58.867400 IP 10.0.0.2 > 10.0.0.1: ICMP echo reply, id 3592, seq 2, length 64
11:08:59.891416 IP 10.0.0.1 > 10.0.0.2: ICMP echo request, id 3592, seq 3, length 64
11:08:59.891454 IP 10.0.0.2 > 10.0.0.1: ICMP echo reply, id 3592, seq 3, length 64
11:08:59.891456 IP 10.0.0.2 > 10.0.0.1: ICMP echo reply, id 3592, seq 3, length 64
11:08:59.891458 IP 10.0.0.2 > 10.0.0.1: ICMP echo reply, id 3592, seq 3, length 64
11:08:59.891459 IP 10.0.0.2 > 10.0.0.1: ICMP echo reply, id 3592, seq 3, length 64
11:09:00.915277 IP 10.0.0.1 > 10.0.0.2: ICMP echo request, id 3592, seq 4, length 64
11:09:00.915346 IP 10.0.0.2 > 10.0.0.1: ICMP echo reply, id 3592, seq 4, length 64
11:09:00.915350 IP 10.0.0.2 > 10.0.0.1: ICMP echo reply, id 3592, seq 4, length 64
11:09:00.915353 IP 10.0.0.2 > 10.0.0.1: ICMP echo reply, id 3592, seq 4, length 64
11:09:00.915356 IP 10.0.0.2 > 10.0.0.1: ICMP echo reply, id 3592, seq 4, length 64
11:09:01.853606 LLDP, length 71: openflow:1
11:09:01.939317 IP 10.0.0.1 > 10.0.0.2: ICMP echo request, id 3592, seq 5, length 64
11:09:01.939363 IP 10.0.0.2 > 10.0.0.1: ICMP echo reply, id 3592, seq 5, length 64
11:09:01.939365 IP 10.0.0.2 > 10.0.0.1: ICMP echo reply, id 3592, seq 5, length 64
11:09:01.939367 IP 10.0.0.2 > 10.0.0.1: ICMP echo reply, id 3592, seq 5, length 64
11:09:01.939369 IP 10.0.0.2 > 10.0.0.1: ICMP echo reply, id 3592, seq 5, length 64
11:09:02.963281 IP 10.0.0.1 > 10.0.0.2: ICMP echo request, id 3592, seq 6, length 64
11:09:02.963315 IP 10.0.0.2 > 10.0.0.1: ICMP echo reply, id 3592, seq 6, length 64
11:09:02.963317 IP 10.0.0.2 > 10.0.0.1: ICMP echo reply, id 3592, seq 6, length 64
11:09:02.963318 IP 10.0.0.2 > 10.0.0.1: ICMP echo reply, id 3592, seq 6, length 64
11:09:02.963319 IP 10.0.0.2 > 10.0.0.1: ICMP echo reply, id 3592, seq 6, length 64
11:09:02.995532 ARP, Request who-has 10.0.0.1 tell 10.0.0.2, length 28
11:09:02.995540 ARP, Reply 10.0.0.1 is-at 00:00:00:00:00:01, length 28
11:09:02.995547 ARP, Request who-has 10.0.0.1 tell 10.0.0.2, length 28
11:09:02.995550 ARP, Reply 10.0.0.1 is-at 00:00:00:00:00:01, length 28
11:09:03.987296 IP 10.0.0.1 > 10.0.0.2: ICMP echo request, id 3592, seq 7, length 64
11:09:03.987347 IP 10.0.0.2 > 10.0.0.1: ICMP echo reply, id 3592, seq 7, length 64
11:09:03.987350 IP 10.0.0.2 > 10.0.0.1: ICMP echo reply, id 3592, seq 7, length 64
11:09:03.987352 IP 10.0.0.2 > 10.0.0.1: ICMP echo reply, id 3592, seq 7, length 64
11:09:03.987355 IP 10.0.0.2 > 10.0.0.1: ICMP echo reply, id 3592, seq 7, length 64
11:09:05.011330 IP 10.0.0.1 > 10.0.0.2: ICMP echo request, id 3592, seq 8, length 64
11:09:05.011405 IP 10.0.0.2 > 10.0.0.1: ICMP echo reply, id 3592, seq 8, length 64
11:09:05.011409 IP 10.0.0.2 > 10.0.0.1: ICMP echo reply, id 3592, seq 8, length 64
11:09:05.011413 IP 10.0.0.2 > 10.0.0.1: ICMP echo reply, id 3592, seq 8, length 64
11:09:05.011417 IP 10.0.0.2 > 10.0.0.1: ICMP echo reply, id 3592, seq 8, length 64
11:09:06.035357 IP 10.0.0.1 > 10.0.0.2: ICMP echo request, id 3592, seq 9, length 64
11:09:06.035425 IP 10.0.0.2 > 10.0.0.1: ICMP echo reply, id 3592, seq 9, length 64
11:09:06.035429 IP 10.0.0.2 > 10.0.0.1: ICMP echo reply, id 3592, seq 9, length 64
11:09:06.035432 IP 10.0.0.2 > 10.0.0.1: ICMP echo reply, id 3592, seq 9, length 64
11:09:06.035435 IP 10.0.0.2 > 10.0.0.1: ICMP echo reply, id 3592, seq 9, length 64
11:09:06.853120 LLDP, length 71: openflow:1
11:09:07.059253 IP 10.0.0.1 > 10.0.0.2: ICMP echo request, id 3592, seq 10, length 64
11:09:07.059309 IP 10.0.0.2 > 10.0.0.1: ICMP echo reply, id 3592, seq 10, length 64
11:09:07.059312 IP 10.0.0.2 > 10.0.0.1: ICMP echo reply, id 3592, seq 10, length 64
11:09:07.059314 IP 10.0.0.2 > 10.0.0.1: ICMP echo reply, id 3592, seq 10, length 64
11:09:07.059316 IP 10.0.0.2 > 10.0.0.1: ICMP echo reply, id 3592, seq 10, length 64
11:09:08.083273 IP 10.0.0.1 > 10.0.0.2: ICMP echo request, id 3592, seq 11, length 64
11:09:08.083306 IP 10.0.0.2 > 10.0.0.1: ICMP echo reply, id 3592, seq 11, length 64
11:09:08.083308 IP 10.0.0.2 > 10.0.0.1: ICMP echo reply, id 3592, seq 11, length 64
11:09:08.083309 IP 10.0.0.2 > 10.0.0.1: ICMP echo reply, id 3592, seq 11, length 64
11:09:08.083310 IP 10.0.0.2 > 10.0.0.1: ICMP echo reply, id 3592, seq 11, length 64
11:09:09.107311 IP 10.0.0.1 > 10.0.0.2: ICMP echo request, id 3592, seq 12, length 64
11:09:09.107371 IP 10.0.0.2 > 10.0.0.1: ICMP echo reply, id 3592, seq 12, length 64
11:09:09.107375 IP 10.0.0.2 > 10.0.0.1: ICMP echo reply, id 3592, seq 12, length 64
11:09:09.107378 IP 10.0.0.2 > 10.0.0.1: ICMP echo reply, id 3592, seq 12, length 64
11:09:09.107381 IP 10.0.0.2 > 10.0.0.1: ICMP echo reply, id 3592, seq 12, length 64
11:09:10.131461 IP 10.0.0.1 > 10.0.0.2: ICMP echo request, id 3592, seq 13, length 64
11:09:10.131520 IP 10.0.0.2 > 10.0.0.1: ICMP echo reply, id 3592, seq 13, length 64
11:09:10.131524 IP 10.0.0.2 > 10.0.0.1: ICMP echo reply, id 3592, seq 13, length 64
11:09:10.131527 IP 10.0.0.2 > 10.0.0.1: ICMP echo reply, id 3592, seq 13, length 64
11:09:10.131529 IP 10.0.0.2 > 10.0.0.1: ICMP echo reply, id 3592, seq 13, length 64
11:09:11.155481 IP 10.0.0.1 > 10.0.0.2: ICMP echo request, id 3592, seq 14, length 64
11:09:11.155549 IP 10.0.0.2 > 10.0.0.1: ICMP echo reply, id 3592, seq 14, length 64
11:09:11.155553 IP 10.0.0.2 > 10.0.0.1: ICMP echo reply, id 3592, seq 14, length 64
11:09:11.155556 IP 10.0.0.2 > 10.0.0.1: ICMP echo reply, id 3592, seq 14, length 64
11:09:11.155559 IP 10.0.0.2 > 10.0.0.1: ICMP echo reply, id 3592, seq 14, length 64
11:09:11.853440 LLDP, length 71: openflow:1
11:09:12.179304 IP 10.0.0.1 > 10.0.0.2: ICMP echo request, id 3592, seq 15, length 64
11:09:12.179363 IP 10.0.0.2 > 10.0.0.1: ICMP echo reply, id 3592, seq 15, length 64
11:09:12.179368 IP 10.0.0.2 > 10.0.0.1: ICMP echo reply, id 3592, seq 15, length 64
11:09:12.179372 IP 10.0.0.2 > 10.0.0.1: ICMP echo reply, id 3592, seq 15, length 64
11:09:12.179376 IP 10.0.0.2 > 10.0.0.1: ICMP echo reply, id 3592, seq 15, length 64
11:09:13.203266 IP 10.0.0.1 > 10.0.0.2: ICMP echo request, id 3592, seq 16, length 64
11:09:13.203328 IP 10.0.0.2 > 10.0.0.1: ICMP echo reply, id 3592, seq 16, length 64
11:09:13.203333 IP 10.0.0.2 > 10.0.0.1: ICMP echo reply, id 3592, seq 16, length 64
11:09:13.203335 IP 10.0.0.2 > 10.0.0.1: ICMP echo reply, id 3592, seq 16, length 64
11:09:13.203338 IP 10.0.0.2 > 10.0.0.1: ICMP echo reply, id 3592, seq 16, length 64
11:09:14.227329 IP 10.0.0.1 > 10.0.0.2: ICMP echo request, id 3592, seq 17, length 64
11:09:14.227367 IP 10.0.0.2 > 10.0.0.1: ICMP echo reply, id 3592, seq 17, length 64
11:09:14.227369 IP 10.0.0.2 > 10.0.0.1: ICMP echo reply, id 3592, seq 17, length 64
11:09:14.227371 IP 10.0.0.2 > 10.0.0.1: ICMP echo reply, id 3592, seq 17, length 64
11:09:14.227372 IP 10.0.0.2 > 10.0.0.1: ICMP echo reply, id 3592, seq 17, length 64

