16:21:59.935604 IP 10.0.0.1 > 20.0.0.1: ICMP echo request, id 16164, seq 51, length 64
16:21:59.935632 IP 20.0.0.1 > 10.0.0.1: ICMP echo reply, id 16164, seq 51, length 64
16:22:00.959604 IP 10.0.0.1 > 20.0.0.1: ICMP echo request, id 16164, seq 52, length 64
16:22:00.959631 IP 20.0.0.1 > 10.0.0.1: ICMP echo reply, id 16164, seq 52, length 64
16:22:01.983622 IP 10.0.0.1 > 20.0.0.1: ICMP echo request, id 16164, seq 53, length 64
16:22:01.983649 IP 20.0.0.1 > 10.0.0.1: ICMP echo reply, id 16164, seq 53, length 64
16:22:03.007402 IP 10.0.0.1 > 20.0.0.1: ICMP echo request, id 16164, seq 54, length 64
16:22:03.007421 IP 20.0.0.1 > 10.0.0.1: ICMP echo reply, id 16164, seq 54, length 64
16:22:03.103561 ARP, Request who-has 10.0.0.1 tell 20.0.0.1, length 28
16:22:03.103996 ARP, Reply 10.0.0.1 is-at 00:00:00:00:00:01 (oui Ethernet), length 28
16:22:04.031586 IP 10.0.0.1 > 20.0.0.1: ICMP echo request, id 16164, seq 55, length 64
16:22:04.031612 IP 20.0.0.1 > 10.0.0.1: ICMP echo reply, id 16164, seq 55, length 64
16:22:05.055477 IP 10.0.0.1 > 20.0.0.1: ICMP echo request, id 16164, seq 56, length 64
16:22:05.055503 IP 20.0.0.1 > 10.0.0.1: ICMP echo reply, id 16164, seq 56, length 64
16:22:06.079595 IP 10.0.0.1 > 20.0.0.1: ICMP echo request, id 16164, seq 57, length 64
16:22:06.079622 IP 20.0.0.1 > 10.0.0.1: ICMP echo reply, id 16164, seq 57, length 64
16:22:07.107516 IP 10.0.0.1 > 20.0.0.1: ICMP echo request, id 16164, seq 58, length 64
16:22:07.107541 IP 20.0.0.1 > 10.0.0.1: ICMP echo reply, id 16164, seq 58, length 64
16:22:08.127511 IP 10.0.0.1 > 20.0.0.1: ICMP echo request, id 16164, seq 59, length 64
16:22:08.127538 IP 20.0.0.1 > 10.0.0.1: ICMP echo reply, id 16164, seq 59, length 64
16:22:09.151520 IP 10.0.0.1 > 20.0.0.1: ICMP echo request, id 16164, seq 60, length 64
16:22:09.151547 IP 20.0.0.1 > 10.0.0.1: ICMP echo reply, id 16164, seq 60, length 64
16:22:10.175513 IP 10.0.0.1 > 20.0.0.1: ICMP echo request, id 16164, seq 61, length 64
16:22:10.175540 IP 20.0.0.1 > 10.0.0.1: ICMP echo reply, id 16164, seq 61, length 64
16:22:11.199467 IP 10.0.0.1 > 20.0.0.1: ICMP echo request, id 16164, seq 62, length 64
16:22:11.199493 IP 20.0.0.1 > 10.0.0.1: ICMP echo reply, id 16164, seq 62, length 64
16:22:12.223597 IP 10.0.0.1 > 20.0.0.1: ICMP echo request, id 16164, seq 63, length 64
16:22:12.223624 IP 20.0.0.1 > 10.0.0.1: ICMP echo reply, id 16164, seq 63, length 64
16:22:13.247583 IP 10.0.0.1 > 20.0.0.1: ICMP echo request, id 16164, seq 64, length 64
16:22:13.247610 IP 20.0.0.1 > 10.0.0.1: ICMP echo reply, id 16164, seq 64, length 64
16:22:14.271523 IP 10.0.0.1 > 20.0.0.1: ICMP echo request, id 16164, seq 65, length 64
16:22:14.271550 IP 20.0.0.1 > 10.0.0.1: ICMP echo reply, id 16164, seq 65, length 64
16:22:15.295582 IP 10.0.0.1 > 20.0.0.1: ICMP echo request, id 16164, seq 66, length 64
16:22:15.295609 IP 20.0.0.1 > 10.0.0.1: ICMP echo reply, id 16164, seq 66, length 64
16:22:16.319526 IP 10.0.0.1 > 20.0.0.1: ICMP echo request, id 16164, seq 67, length 64
16:22:16.319557 IP 20.0.0.1 > 10.0.0.1: ICMP echo reply, id 16164, seq 67, length 64
16:22:17.343592 IP 10.0.0.1 > 20.0.0.1: ICMP echo request, id 16164, seq 68, length 64
16:22:17.343619 IP 20.0.0.1 > 10.0.0.1: ICMP echo reply, id 16164, seq 68, length 64
16:22:18.367503 IP 10.0.0.1 > 20.0.0.1: ICMP echo request, id 16164, seq 69, length 64
16:22:18.367531 IP 20.0.0.1 > 10.0.0.1: ICMP echo reply, id 16164, seq 69, length 64
16:22:19.391527 IP 10.0.0.1 > 20.0.0.1: ICMP echo request, id 16164, seq 70, length 64
16:22:19.391554 IP 20.0.0.1 > 10.0.0.1: ICMP echo reply, id 16164, seq 70, length 64
16:22:20.255466 IP6 fe80::200:ff:fe00:3 > ip6-allrouters: ICMP6, router solicitation, length 16
16:22:20.415602 IP 10.0.0.1 > 20.0.0.1: ICMP echo request, id 16164, seq 71, length 64
16:22:20.415628 IP 20.0.0.1 > 10.0.0.1: ICMP echo reply, id 16164, seq 71, length 64
16:22:21.439609 IP 10.0.0.1 > 20.0.0.1: ICMP echo request, id 16164, seq 72, length 64
16:22:21.439635 IP 20.0.0.1 > 10.0.0.1: ICMP echo reply, id 16164, seq 72, length 64
16:22:22.463511 IP 10.0.0.1 > 20.0.0.1: ICMP echo request, id 16164, seq 73, length 64
16:22:22.463538 IP 20.0.0.1 > 10.0.0.1: ICMP echo reply, id 16164, seq 73, length 64
16:22:23.487489 IP 10.0.0.1 > 20.0.0.1: ICMP echo request, id 16164, seq 74, length 64
16:22:23.487521 IP 20.0.0.1 > 10.0.0.1: ICMP echo reply, id 16164, seq 74, length 64

