16:22:57.855507 IP 10.0.0.1 > 20.0.0.1: ICMP echo request, id 16390, seq 10, length 64
16:22:57.855533 IP 20.0.0.1 > 10.0.0.1: ICMP echo reply, id 16390, seq 10, length 64
16:22:58.879507 IP 10.0.0.1 > 20.0.0.1: ICMP echo request, id 16390, seq 11, length 64
16:22:58.879533 IP 20.0.0.1 > 10.0.0.1: ICMP echo reply, id 16390, seq 11, length 64
16:22:59.903477 IP 10.0.0.1 > 20.0.0.1: ICMP echo request, id 16390, seq 12, length 64
16:22:59.903503 IP 20.0.0.1 > 10.0.0.1: ICMP echo reply, id 16390, seq 12, length 64
16:23:00.927593 IP 10.0.0.1 > 20.0.0.1: ICMP echo request, id 16390, seq 13, length 64
16:23:00.927620 IP 20.0.0.1 > 10.0.0.1: ICMP echo reply, id 16390, seq 13, length 64
16:23:01.951583 IP 10.0.0.1 > 20.0.0.1: ICMP echo request, id 16390, seq 14, length 64
16:23:01.951609 IP 20.0.0.1 > 10.0.0.1: ICMP echo reply, id 16390, seq 14, length 64
16:23:02.975598 IP 10.0.0.1 > 20.0.0.1: ICMP echo request, id 16390, seq 15, length 64
16:23:02.975625 IP 20.0.0.1 > 10.0.0.1: ICMP echo reply, id 16390, seq 15, length 64
16:23:03.999569 IP 10.0.0.1 > 20.0.0.1: ICMP echo request, id 16390, seq 16, length 64
16:23:03.999595 IP 20.0.0.1 > 10.0.0.1: ICMP echo reply, id 16390, seq 16, length 64
16:23:05.023574 IP 10.0.0.1 > 20.0.0.1: ICMP echo request, id 16390, seq 17, length 64
16:23:05.023601 IP 20.0.0.1 > 10.0.0.1: ICMP echo reply, id 16390, seq 17, length 64
16:23:06.047621 IP 10.0.0.1 > 20.0.0.1: ICMP echo request, id 16390, seq 18, length 64
16:23:06.047647 IP 20.0.0.1 > 10.0.0.1: ICMP echo reply, id 16390, seq 18, length 64
16:23:07.071631 IP 10.0.0.1 > 20.0.0.1: ICMP echo request, id 16390, seq 19, length 64
16:23:07.071658 IP 20.0.0.1 > 10.0.0.1: ICMP echo reply, id 16390, seq 19, length 64
16:23:08.095612 IP 10.0.0.1 > 20.0.0.1: ICMP echo request, id 16390, seq 20, length 64
16:23:08.095639 IP 20.0.0.1 > 10.0.0.1: ICMP echo reply, id 16390, seq 20, length 64
16:23:09.119609 IP 10.0.0.1 > 20.0.0.1: ICMP echo request, id 16390, seq 21, length 64
16:23:09.119635 IP 20.0.0.1 > 10.0.0.1: ICMP echo reply, id 16390, seq 21, length 64
16:23:10.143572 IP 10.0.0.1 > 20.0.0.1: ICMP echo request, id 16390, seq 22, length 64
16:23:10.143599 IP 20.0.0.1 > 10.0.0.1: ICMP echo reply, id 16390, seq 22, length 64
16:23:11.167501 IP 10.0.0.1 > 20.0.0.1: ICMP echo request, id 16390, seq 23, length 64
16:23:11.167528 IP 20.0.0.1 > 10.0.0.1: ICMP echo reply, id 16390, seq 23, length 64
16:23:12.191463 IP 10.0.0.1 > 20.0.0.1: ICMP echo request, id 16390, seq 24, length 64
16:23:12.191489 IP 20.0.0.1 > 10.0.0.1: ICMP echo reply, id 16390, seq 24, length 64
16:23:13.215523 IP 10.0.0.1 > 20.0.0.1: ICMP echo request, id 16390, seq 25, length 64
16:23:13.215550 IP 20.0.0.1 > 10.0.0.1: ICMP echo reply, id 16390, seq 25, length 64
16:23:14.239586 IP 10.0.0.1 > 20.0.0.1: ICMP echo request, id 16390, seq 26, length 64
16:23:14.239613 IP 20.0.0.1 > 10.0.0.1: ICMP echo reply, id 16390, seq 26, length 64
16:23:15.263619 IP 10.0.0.1 > 20.0.0.1: ICMP echo request, id 16390, seq 27, length 64
16:23:15.263646 IP 20.0.0.1 > 10.0.0.1: ICMP echo reply, id 16390, seq 27, length 64
16:23:16.287612 IP 10.0.0.1 > 20.0.0.1: ICMP echo request, id 16390, seq 28, length 64
16:23:16.287638 IP 20.0.0.1 > 10.0.0.1: ICMP echo reply, id 16390, seq 28, length 64
16:23:17.311480 IP 10.0.0.1 > 20.0.0.1: ICMP echo request, id 16390, seq 29, length 64
16:23:17.311508 IP 20.0.0.1 > 10.0.0.1: ICMP echo reply, id 16390, seq 29, length 64
16:23:18.335595 IP 10.0.0.1 > 20.0.0.1: ICMP echo request, id 16390, seq 30, length 64
16:23:18.335621 IP 20.0.0.1 > 10.0.0.1: ICMP echo reply, id 16390, seq 30, length 64
16:23:19.359596 IP 10.0.0.1 > 20.0.0.1: ICMP echo request, id 16390, seq 31, length 64
16:23:19.359623 IP 20.0.0.1 > 10.0.0.1: ICMP echo reply, id 16390, seq 31, length 64
16:23:20.383632 IP 10.0.0.1 > 20.0.0.1: ICMP echo request, id 16390, seq 32, length 64
16:23:20.383658 IP 20.0.0.1 > 10.0.0.1: ICMP echo reply, id 16390, seq 32, length 64
16:23:21.407641 IP 10.0.0.1 > 20.0.0.1: ICMP echo request, id 16390, seq 33, length 64
16:23:21.407668 IP 20.0.0.1 > 10.0.0.1: ICMP echo reply, id 16390, seq 33, length 64
16:23:22.431598 IP 10.0.0.1 > 20.0.0.1: ICMP echo request, id 16390, seq 34, length 64
16:23:22.431625 IP 20.0.0.1 > 10.0.0.1: ICMP echo reply, id 16390, seq 34, length 64
16:23:23.455589 IP 10.0.0.1 > 20.0.0.1: ICMP echo request, id 16390, seq 35, length 64
16:23:23.455616 IP 20.0.0.1 > 10.0.0.1: ICMP echo reply, id 16390, seq 35, length 64
16:23:24.479516 IP 10.0.0.1 > 20.0.0.1: ICMP echo request, id 16390, seq 36, length 64
16:23:24.479544 IP 20.0.0.1 > 10.0.0.1: ICMP echo reply, id 16390, seq 36, length 64
16:23:25.503582 IP 10.0.0.1 > 20.0.0.1: ICMP echo request, id 16390, seq 37, length 64
16:23:25.503609 IP 20.0.0.1 > 10.0.0.1: ICMP echo reply, id 16390, seq 37, length 64
16:23:26.527508 IP 10.0.0.1 > 20.0.0.1: ICMP echo request, id 16390, seq 38, length 64
16:23:26.527536 IP 20.0.0.1 > 10.0.0.1: ICMP echo reply, id 16390, seq 38, length 64
16:23:27.551518 IP 10.0.0.1 > 20.0.0.1: ICMP echo request, id 16390, seq 39, length 64
16:23:27.551545 IP 20.0.0.1 > 10.0.0.1: ICMP echo reply, id 16390, seq 39, length 64
16:23:28.575538 IP 10.0.0.1 > 20.0.0.1: ICMP echo request, id 16390, seq 40, length 64
16:23:28.575566 IP 20.0.0.1 > 10.0.0.1: ICMP echo reply, id 16390, seq 40, length 64
16:23:29.599527 IP 10.0.0.1 > 20.0.0.1: ICMP echo request, id 16390, seq 41, length 64
16:23:29.599561 IP 20.0.0.1 > 10.0.0.1: ICMP echo reply, id 16390, seq 41, length 64
16:23:29.635443 ARP, Request who-has 10.0.0.1 tell 20.0.0.1, length 28
16:23:29.635780 ARP, Reply 10.0.0.1 is-at 00:00:00:00:00:01 (oui Ethernet), length 28

