15:51:12.004619 IP 10.0.0.1 > 10.0.0.2: ICMP echo request, id 21692, seq 104, length 64
15:51:12.004816 IP 10.0.0.2 > 10.0.0.1: ICMP echo reply, id 21692, seq 104, length 64
15:51:13.028463 IP 10.0.0.1 > 10.0.0.2: ICMP echo request, id 21692, seq 105, length 64
15:51:13.028676 IP 10.0.0.2 > 10.0.0.1: ICMP echo reply, id 21692, seq 105, length 64
15:51:14.052322 IP 10.0.0.1 > 10.0.0.2: ICMP echo request, id 21692, seq 106, length 64
15:51:14.052521 IP 10.0.0.2 > 10.0.0.1: ICMP echo reply, id 21692, seq 106, length 64
15:51:15.076445 IP 10.0.0.1 > 10.0.0.2: ICMP echo request, id 21692, seq 107, length 64
15:51:15.076661 IP 10.0.0.2 > 10.0.0.1: ICMP echo reply, id 21692, seq 107, length 64
15:51:15.809728 LLDP, length 71: openflow:1
15:51:15.809893 LLDP, length 71: openflow:2
15:51:16.100612 IP 10.0.0.1 > 10.0.0.2: ICMP echo request, id 21692, seq 108, length 64
15:51:16.100853 IP 10.0.0.2 > 10.0.0.1: ICMP echo reply, id 21692, seq 108, length 64
15:51:17.124559 IP 10.0.0.1 > 10.0.0.2: ICMP echo request, id 21692, seq 109, length 64
15:51:17.124790 IP 10.0.0.2 > 10.0.0.1: ICMP echo reply, id 21692, seq 109, length 64
15:51:18.148380 IP 10.0.0.1 > 10.0.0.2: ICMP echo request, id 21692, seq 110, length 64
15:51:18.148578 IP 10.0.0.2 > 10.0.0.1: ICMP echo reply, id 21692, seq 110, length 64
15:51:19.172452 IP 10.0.0.1 > 10.0.0.2: ICMP echo request, id 21692, seq 111, length 64
15:51:19.172662 IP 10.0.0.2 > 10.0.0.1: ICMP echo reply, id 21692, seq 111, length 64
15:51:19.588527 IP6 fe80::7ca7:91ff:fe8d:8441 > ip6-allrouters: ICMP6, router solicitation, length 16
15:51:20.196547 IP 10.0.0.1 > 10.0.0.2: ICMP echo request, id 21692, seq 112, length 64
15:51:20.196778 IP 10.0.0.2 > 10.0.0.1: ICMP echo reply, id 21692, seq 112, length 64
15:51:20.809712 LLDP, length 71: openflow:1
15:51:20.809880 LLDP, length 71: openflow:2
15:51:21.220306 IP 10.0.0.1 > 10.0.0.2: ICMP echo request, id 21692, seq 113, length 64
15:51:21.220486 IP 10.0.0.2 > 10.0.0.1: ICMP echo reply, id 21692, seq 113, length 64
15:51:22.244450 IP 10.0.0.1 > 10.0.0.2: ICMP echo request, id 21692, seq 114, length 64
15:51:22.244663 IP 10.0.0.2 > 10.0.0.1: ICMP echo reply, id 21692, seq 114, length 64
15:51:23.268444 IP 10.0.0.1 > 10.0.0.2: ICMP echo request, id 21692, seq 115, length 64
15:51:23.268677 IP 10.0.0.2 > 10.0.0.1: ICMP echo reply, id 21692, seq 115, length 64
15:51:24.292322 IP 10.0.0.1 > 10.0.0.2: ICMP echo request, id 21692, seq 116, length 64
15:51:24.292522 IP 10.0.0.2 > 10.0.0.1: ICMP echo reply, id 21692, seq 116, length 64
15:51:25.316459 IP 10.0.0.1 > 10.0.0.2: ICMP echo request, id 21692, seq 117, length 64
15:51:25.316650 IP 10.0.0.2 > 10.0.0.1: ICMP echo reply, id 21692, seq 117, length 64
15:51:25.809720 LLDP, length 71: openflow:1
15:51:25.809932 LLDP, length 71: openflow:2

