15:00:05.555279 IP 10.0.0.1 > 10.0.0.3: ICMP echo request, id 23185, seq 78, length 64
15:00:06.579309 IP 10.0.0.1 > 10.0.0.3: ICMP echo request, id 23185, seq 79, length 64
15:00:07.603288 IP 10.0.0.1 > 10.0.0.3: ICMP echo request, id 23185, seq 80, length 64
15:00:08.631243 IP 10.0.0.1 > 10.0.0.3: ICMP echo request, id 23185, seq 81, length 64
15:00:09.651300 IP 10.0.0.1 > 10.0.0.3: ICMP echo request, id 23185, seq 82, length 64
15:00:10.675252 IP 10.0.0.1 > 10.0.0.3: ICMP echo request, id 23185, seq 83, length 64
15:00:11.699276 IP 10.0.0.1 > 10.0.0.3: ICMP echo request, id 23185, seq 84, length 64
15:00:12.723241 IP 10.0.0.1 > 10.0.0.3: ICMP echo request, id 23185, seq 85, length 64
15:00:13.751244 IP 10.0.0.1 > 10.0.0.3: ICMP echo request, id 23185, seq 86, length 64
15:00:14.771374 IP 10.0.0.1 > 10.0.0.3: ICMP echo request, id 23185, seq 87, length 64
15:00:15.795274 IP 10.0.0.1 > 10.0.0.3: ICMP echo request, id 23185, seq 88, length 64
15:00:16.819299 IP 10.0.0.1 > 10.0.0.3: ICMP echo request, id 23185, seq 89, length 64
15:00:17.843247 IP 10.0.0.1 > 10.0.0.3: ICMP echo request, id 23185, seq 90, length 64
15:00:18.867284 IP 10.0.0.1 > 10.0.0.3: ICMP echo request, id 23185, seq 91, length 64
15:00:19.891271 IP 10.0.0.1 > 10.0.0.3: ICMP echo request, id 23185, seq 92, length 64
15:00:20.915281 IP 10.0.0.1 > 10.0.0.3: ICMP echo request, id 23185, seq 93, length 64

