14:58:46.724370 IP 10.0.0.1 > 10.0.0.2: ICMP echo request, id 23185, seq 1, length 64
14:58:46.724400 IP 10.0.0.2 > 10.0.0.1: ICMP echo reply, id 23185, seq 1, length 64
14:58:46.853391 LLDP, length 71: openflow:2
14:58:47.731487 IP 10.0.0.1 > 10.0.0.2: ICMP echo request, id 23185, seq 2, length 64
14:58:47.731517 IP 10.0.0.2 > 10.0.0.1: ICMP echo reply, id 23185, seq 2, length 64
14:58:48.755474 IP 10.0.0.1 > 10.0.0.2: ICMP echo request, id 23185, seq 3, length 64
14:58:48.755503 IP 10.0.0.2 > 10.0.0.1: ICMP echo reply, id 23185, seq 3, length 64
14:58:49.779366 IP 10.0.0.1 > 10.0.0.2: ICMP echo request, id 23185, seq 4, length 64
14:58:49.779379 IP 10.0.0.2 > 10.0.0.1: ICMP echo reply, id 23185, seq 4, length 64
14:58:50.803380 IP 10.0.0.1 > 10.0.0.2: ICMP echo request, id 23185, seq 5, length 64
14:58:50.803394 IP 10.0.0.2 > 10.0.0.1: ICMP echo reply, id 23185, seq 5, length 64
14:58:51.827328 IP 10.0.0.1 > 10.0.0.2: ICMP echo request, id 23185, seq 6, length 64
14:58:51.827342 IP 10.0.0.2 > 10.0.0.1: ICMP echo reply, id 23185, seq 6, length 64
14:58:51.853220 LLDP, length 71: openflow:2
14:58:51.923263 ARP, Request who-has 10.0.0.1 tell 10.0.0.2, length 28
14:58:51.923461 ARP, Reply 10.0.0.1 is-at 00:00:00:00:00:01, length 28
14:58:52.851356 IP 10.0.0.1 > 10.0.0.2: ICMP echo request, id 23185, seq 7, length 64
14:58:52.851371 IP 10.0.0.2 > 10.0.0.1: ICMP echo reply, id 23185, seq 7, length 64
14:58:53.879353 IP 10.0.0.1 > 10.0.0.2: ICMP echo request, id 23185, seq 8, length 64
14:58:53.879375 IP 10.0.0.2 > 10.0.0.1: ICMP echo reply, id 23185, seq 8, length 64
14:58:54.903362 IP 10.0.0.1 > 10.0.0.2: ICMP echo request, id 23185, seq 9, length 64
14:58:54.903378 IP 10.0.0.2 > 10.0.0.1: ICMP echo reply, id 23185, seq 9, length 64
14:58:55.923392 IP 10.0.0.1 > 10.0.0.2: ICMP echo request, id 23185, seq 10, length 64
14:58:55.923408 IP 10.0.0.2 > 10.0.0.1: ICMP echo reply, id 23185, seq 10, length 64
14:58:56.852927 LLDP, length 71: openflow:2
14:58:56.947399 IP 10.0.0.1 > 10.0.0.2: ICMP echo request, id 23185, seq 11, length 64
14:58:56.947416 IP 10.0.0.2 > 10.0.0.1: ICMP echo reply, id 23185, seq 11, length 64
14:58:57.971355 IP 10.0.0.1 > 10.0.0.2: ICMP echo request, id 23185, seq 12, length 64
14:58:57.971372 IP 10.0.0.2 > 10.0.0.1: ICMP echo reply, id 23185, seq 12, length 64
14:58:58.995408 IP 10.0.0.1 > 10.0.0.2: ICMP echo request, id 23185, seq 13, length 64
14:58:58.995432 IP 10.0.0.2 > 10.0.0.1: ICMP echo reply, id 23185, seq 13, length 64
14:59:00.019448 IP 10.0.0.1 > 10.0.0.2: ICMP echo request, id 23185, seq 14, length 64
14:59:00.019473 IP 10.0.0.2 > 10.0.0.1: ICMP echo reply, id 23185, seq 14, length 64
14:59:01.043359 IP 10.0.0.1 > 10.0.0.2: ICMP echo request, id 23185, seq 15, length 64
14:59:01.043373 IP 10.0.0.2 > 10.0.0.1: ICMP echo reply, id 23185, seq 15, length 64
14:59:01.852878 LLDP, length 71: openflow:2
14:59:02.067429 IP 10.0.0.1 > 10.0.0.2: ICMP echo request, id 23185, seq 16, length 64
14:59:02.067451 IP 10.0.0.2 > 10.0.0.1: ICMP echo reply, id 23185, seq 16, length 64
14:59:03.091376 IP 10.0.0.1 > 10.0.0.2: ICMP echo request, id 23185, seq 17, length 64
14:59:03.091388 IP 10.0.0.2 > 10.0.0.1: ICMP echo reply, id 23185, seq 17, length 64
14:59:04.115410 IP 10.0.0.1 > 10.0.0.2: ICMP echo request, id 23185, seq 18, length 64
14:59:04.115435 IP 10.0.0.2 > 10.0.0.1: ICMP echo reply, id 23185, seq 18, length 64
14:59:05.143379 IP 10.0.0.1 > 10.0.0.2: ICMP echo request, id 23185, seq 19, length 64
14:59:05.143393 IP 10.0.0.2 > 10.0.0.1: ICMP echo reply, id 23185, seq 19, length 64
14:59:06.163470 IP 10.0.0.1 > 10.0.0.2: ICMP echo request, id 23185, seq 20, length 64
14:59:06.163494 IP 10.0.0.2 > 10.0.0.1: ICMP echo reply, id 23185, seq 20, length 64
14:59:06.852885 LLDP, length 71: openflow:2
14:59:07.187384 IP 10.0.0.1 > 10.0.0.2: ICMP echo request, id 23185, seq 21, length 64
14:59:07.187403 IP 10.0.0.2 > 10.0.0.1: ICMP echo reply, id 23185, seq 21, length 64
14:59:08.211368 IP 10.0.0.1 > 10.0.0.2: ICMP echo request, id 23185, seq 22, length 64
14:59:08.211384 IP 10.0.0.2 > 10.0.0.1: ICMP echo reply, id 23185, seq 22, length 64
14:59:09.235463 IP 10.0.0.1 > 10.0.0.2: ICMP echo request, id 23185, seq 23, length 64
14:59:09.235494 IP 10.0.0.2 > 10.0.0.1: ICMP echo reply, id 23185, seq 23, length 64
14:59:10.259430 IP 10.0.0.1 > 10.0.0.2: ICMP echo request, id 23185, seq 24, length 64
14:59:10.259453 IP 10.0.0.2 > 10.0.0.1: ICMP echo reply, id 23185, seq 24, length 64
14:59:11.283342 IP 10.0.0.1 > 10.0.0.2: ICMP echo request, id 23185, seq 25, length 64
14:59:11.283359 IP 10.0.0.2 > 10.0.0.1: ICMP echo reply, id 23185, seq 25, length 64
14:59:11.852867 LLDP, length 71: openflow:2
14:59:12.307368 IP 10.0.0.1 > 10.0.0.2: ICMP echo request, id 23185, seq 26, length 64
14:59:12.307381 IP 10.0.0.2 > 10.0.0.1: ICMP echo reply, id 23185, seq 26, length 64
14:59:13.331379 IP 10.0.0.1 > 10.0.0.2: ICMP echo request, id 23185, seq 27, length 64
14:59:13.331394 IP 10.0.0.2 > 10.0.0.1: ICMP echo reply, id 23185, seq 27, length 64
14:59:14.355393 IP 10.0.0.1 > 10.0.0.2: ICMP echo request, id 23185, seq 28, length 64
14:59:14.355409 IP 10.0.0.2 > 10.0.0.1: ICMP echo reply, id 23185, seq 28, length 64
14:59:14.451227 ARP, Request who-has 10.0.0.1 tell 10.0.0.2, length 28
14:59:14.451515 ARP, Reply 10.0.0.1 is-at 00:00:00:00:00:01, length 28
14:59:15.379312 IP 10.0.0.1 > 10.0.0.2: ICMP echo request, id 23185, seq 29, length 64
14:59:15.379324 IP 10.0.0.2 > 10.0.0.1: ICMP echo reply, id 23185, seq 29, length 64
14:59:16.403387 IP 10.0.0.1 > 10.0.0.2: ICMP echo request, id 23185, seq 30, length 64
14:59:16.403402 IP 10.0.0.2 > 10.0.0.1: ICMP echo reply, id 23185, seq 30, length 64
14:59:16.853185 LLDP, length 71: openflow:2
14:59:17.431313 IP 10.0.0.1 > 10.0.0.2: ICMP echo request, id 23185, seq 31, length 64
14:59:17.431325 IP 10.0.0.2 > 10.0.0.1: ICMP echo reply, id 23185, seq 31, length 64
14:59:18.451434 IP 10.0.0.1 > 10.0.0.2: ICMP echo request, id 23185, seq 32, length 64
14:59:18.451456 IP 10.0.0.2 > 10.0.0.1: ICMP echo reply, id 23185, seq 32, length 64
14:59:19.475346 IP 10.0.0.1 > 10.0.0.2: ICMP echo request, id 23185, seq 33, length 64
14:59:19.475357 IP 10.0.0.2 > 10.0.0.1: ICMP echo reply, id 23185, seq 33, length 64
14:59:20.499343 IP 10.0.0.1 > 10.0.0.2: ICMP echo request, id 23185, seq 34, length 64
14:59:20.499358 IP 10.0.0.2 > 10.0.0.1: ICMP echo reply, id 23185, seq 34, length 64
14:59:21.523422 IP 10.0.0.1 > 10.0.0.2: ICMP echo request, id 23185, seq 35, length 64
14:59:21.523450 IP 10.0.0.2 > 10.0.0.1: ICMP echo reply, id 23185, seq 35, length 64
14:59:21.852951 LLDP, length 71: openflow:2
14:59:22.547457 IP 10.0.0.1 > 10.0.0.2: ICMP echo request, id 23185, seq 36, length 64
14:59:22.547480 IP 10.0.0.2 > 10.0.0.1: ICMP echo reply, id 23185, seq 36, length 64
14:59:23.571357 IP 10.0.0.1 > 10.0.0.2: ICMP echo request, id 23185, seq 37, length 64
14:59:23.571376 IP 10.0.0.2 > 10.0.0.1: ICMP echo reply, id 23185, seq 37, length 64
14:59:24.595414 IP 10.0.0.1 > 10.0.0.2: ICMP echo request, id 23185, seq 38, length 64
14:59:24.595436 IP 10.0.0.2 > 10.0.0.1: ICMP echo reply, id 23185, seq 38, length 64
14:59:25.623369 IP 10.0.0.1 > 10.0.0.2: ICMP echo request, id 23185, seq 39, length 64
14:59:25.623390 IP 10.0.0.2 > 10.0.0.1: ICMP echo reply, id 23185, seq 39, length 64
14:59:26.643444 IP 10.0.0.1 > 10.0.0.2: ICMP echo request, id 23185, seq 40, length 64
14:59:26.643482 IP 10.0.0.2 > 10.0.0.1: ICMP echo reply, id 23185, seq 40, length 64
14:59:26.852895 LLDP, length 71: openflow:2
14:59:27.667392 IP 10.0.0.1 > 10.0.0.2: ICMP echo request, id 23185, seq 41, length 64
14:59:27.667405 IP 10.0.0.2 > 10.0.0.1: ICMP echo reply, id 23185, seq 41, length 64
14:59:28.691341 IP 10.0.0.1 > 10.0.0.2: ICMP echo request, id 23185, seq 42, length 64
14:59:28.691358 IP 10.0.0.2 > 10.0.0.1: ICMP echo reply, id 23185, seq 42, length 64
14:59:29.715467 IP 10.0.0.1 > 10.0.0.2: ICMP echo request, id 23185, seq 43, length 64
14:59:29.715494 IP 10.0.0.2 > 10.0.0.1: ICMP echo reply, id 23185, seq 43, length 64
14:59:30.739481 IP 10.0.0.1 > 10.0.0.2: ICMP echo request, id 23185, seq 44, length 64
14:59:30.739512 IP 10.0.0.2 > 10.0.0.1: ICMP echo reply, id 23185, seq 44, length 64

