14:07:17.439522 IP 10.0.0.1 > 10.0.0.2: ICMP echo request, id 27352, seq 279, length 64
14:07:17.439539 IP 10.0.0.2 > 10.0.0.1: ICMP echo reply, id 27352, seq 279, length 64
14:07:17.439555 IP 10.0.0.2 > 10.0.0.1: ICMP echo reply, id 27352, seq 279, length 64
14:07:18.431433 LLDP, length 71: openflow:4
14:07:18.431634 LLDP, length 71: openflow:3
14:07:18.431646 LLDP, length 71: openflow:1
14:07:18.463405 IP 10.0.0.1 > 10.0.0.2: ICMP echo request, id 27352, seq 280, length 64
14:07:18.463421 IP 10.0.0.2 > 10.0.0.1: ICMP echo reply, id 27352, seq 280, length 64
14:07:18.463435 IP 10.0.0.2 > 10.0.0.1: ICMP echo reply, id 27352, seq 280, length 64
14:07:19.487396 IP 10.0.0.1 > 10.0.0.2: ICMP echo request, id 27352, seq 281, length 64
14:07:19.487409 IP 10.0.0.2 > 10.0.0.1: ICMP echo reply, id 27352, seq 281, length 64
14:07:19.487421 IP 10.0.0.2 > 10.0.0.1: ICMP echo reply, id 27352, seq 281, length 64
14:07:20.511400 IP 10.0.0.1 > 10.0.0.2: ICMP echo request, id 27352, seq 282, length 64
14:07:20.511416 IP 10.0.0.2 > 10.0.0.1: ICMP echo reply, id 27352, seq 282, length 64
14:07:20.511431 IP 10.0.0.2 > 10.0.0.1: ICMP echo reply, id 27352, seq 282, length 64
14:07:21.535416 IP 10.0.0.1 > 10.0.0.2: ICMP echo request, id 27352, seq 283, length 64
14:07:21.535429 IP 10.0.0.2 > 10.0.0.1: ICMP echo reply, id 27352, seq 283, length 64
14:07:21.535440 IP 10.0.0.2 > 10.0.0.1: ICMP echo reply, id 27352, seq 283, length 64
14:07:22.559428 IP 10.0.0.1 > 10.0.0.2: ICMP echo request, id 27352, seq 284, length 64
14:07:22.559443 IP 10.0.0.2 > 10.0.0.1: ICMP echo reply, id 27352, seq 284, length 64
14:07:22.559456 IP 10.0.0.2 > 10.0.0.1: ICMP echo reply, id 27352, seq 284, length 64
14:07:23.431380 LLDP, length 71: openflow:4
14:07:23.431466 LLDP, length 71: openflow:1
14:07:23.431518 LLDP, length 71: openflow:3
14:07:23.487360 ARP, Request who-has 10.0.0.1 tell 10.0.0.2, length 28
14:07:23.487618 ARP, Request who-has 10.0.0.1 tell 10.0.0.2, length 28
14:07:23.487642 ARP, Reply 10.0.0.1 is-at 00:00:00:00:00:01, length 28
14:07:23.583409 IP 10.0.0.1 > 10.0.0.2: ICMP echo request, id 27352, seq 285, length 64
14:07:23.583425 IP 10.0.0.2 > 10.0.0.1: ICMP echo reply, id 27352, seq 285, length 64
14:07:23.583442 IP 10.0.0.2 > 10.0.0.1: ICMP echo reply, id 27352, seq 285, length 64
14:07:24.607437 IP 10.0.0.1 > 10.0.0.2: ICMP echo request, id 27352, seq 286, length 64
14:07:24.607453 IP 10.0.0.2 > 10.0.0.1: ICMP echo reply, id 27352, seq 286, length 64
14:07:24.607466 IP 10.0.0.2 > 10.0.0.1: ICMP echo reply, id 27352, seq 286, length 64
14:07:25.631402 IP 10.0.0.1 > 10.0.0.2: ICMP echo request, id 27352, seq 287, length 64
14:07:25.631415 IP 10.0.0.2 > 10.0.0.1: ICMP echo reply, id 27352, seq 287, length 64
14:07:25.631427 IP 10.0.0.2 > 10.0.0.1: ICMP echo reply, id 27352, seq 287, length 64
14:07:26.655431 IP 10.0.0.1 > 10.0.0.2: ICMP echo request, id 27352, seq 288, length 64
14:07:26.655456 IP 10.0.0.2 > 10.0.0.1: ICMP echo reply, id 27352, seq 288, length 64
14:07:26.655479 IP 10.0.0.2 > 10.0.0.1: ICMP echo reply, id 27352, seq 288, length 64
14:07:27.679392 IP 10.0.0.1 > 10.0.0.2: ICMP echo request, id 27352, seq 289, length 64
14:07:27.679405 IP 10.0.0.2 > 10.0.0.1: ICMP echo reply, id 27352, seq 289, length 64
14:07:27.679416 IP 10.0.0.2 > 10.0.0.1: ICMP echo reply, id 27352, seq 289, length 64
14:07:28.431406 LLDP, length 71: openflow:4
14:07:28.431475 LLDP, length 71: openflow:1
14:07:28.431543 LLDP, length 71: openflow:3
14:07:28.703396 IP 10.0.0.1 > 10.0.0.2: ICMP echo request, id 27352, seq 290, length 64
14:07:28.703411 IP 10.0.0.2 > 10.0.0.1: ICMP echo reply, id 27352, seq 290, length 64
14:07:28.703426 IP 10.0.0.2 > 10.0.0.1: ICMP echo reply, id 27352, seq 290, length 64
14:07:29.727396 IP 10.0.0.1 > 10.0.0.2: ICMP echo request, id 27352, seq 291, length 64
14:07:29.727410 IP 10.0.0.2 > 10.0.0.1: ICMP echo reply, id 27352, seq 291, length 64
14:07:29.727423 IP 10.0.0.2 > 10.0.0.1: ICMP echo reply, id 27352, seq 291, length 64
14:07:30.751455 IP 10.0.0.1 > 10.0.0.2: ICMP echo request, id 27352, seq 292, length 64
14:07:30.751490 IP 10.0.0.2 > 10.0.0.1: ICMP echo reply, id 27352, seq 292, length 64
14:07:30.751521 IP 10.0.0.2 > 10.0.0.1: ICMP echo reply, id 27352, seq 292, length 64
14:07:31.779440 IP 10.0.0.1 > 10.0.0.2: ICMP echo request, id 27352, seq 293, length 64
14:07:31.779468 IP 10.0.0.2 > 10.0.0.1: ICMP echo reply, id 27352, seq 293, length 64
14:07:31.779494 IP 10.0.0.2 > 10.0.0.1: ICMP echo reply, id 27352, seq 293, length 64
14:07:32.799439 IP 10.0.0.1 > 10.0.0.2: ICMP echo request, id 27352, seq 294, length 64
14:07:32.799452 IP 10.0.0.2 > 10.0.0.1: ICMP echo reply, id 27352, seq 294, length 64
14:07:32.799463 IP 10.0.0.2 > 10.0.0.1: ICMP echo reply, id 27352, seq 294, length 64
14:07:33.431428 LLDP, length 71: openflow:4
14:07:33.431619 LLDP, length 71: openflow:3
14:07:33.431643 LLDP, length 71: openflow:1
14:07:33.823429 IP 10.0.0.1 > 10.0.0.2: ICMP echo request, id 27352, seq 295, length 64
14:07:33.823443 IP 10.0.0.2 > 10.0.0.1: ICMP echo reply, id 27352, seq 295, length 64
14:07:33.823457 IP 10.0.0.2 > 10.0.0.1: ICMP echo reply, id 27352, seq 295, length 64
14:07:34.847421 IP 10.0.0.1 > 10.0.0.2: ICMP echo request, id 27352, seq 296, length 64
14:07:34.847434 IP 10.0.0.2 > 10.0.0.1: ICMP echo reply, id 27352, seq 296, length 64
14:07:34.847445 IP 10.0.0.2 > 10.0.0.1: ICMP echo reply, id 27352, seq 296, length 64
14:07:35.871426 IP 10.0.0.1 > 10.0.0.2: ICMP echo request, id 27352, seq 297, length 64
14:07:35.871440 IP 10.0.0.2 > 10.0.0.1: ICMP echo reply, id 27352, seq 297, length 64
14:07:35.871452 IP 10.0.0.2 > 10.0.0.1: ICMP echo reply, id 27352, seq 297, length 64
14:07:36.895416 IP 10.0.0.1 > 10.0.0.2: ICMP echo request, id 27352, seq 298, length 64
14:07:36.895429 IP 10.0.0.2 > 10.0.0.1: ICMP echo reply, id 27352, seq 298, length 64
14:07:36.895439 IP 10.0.0.2 > 10.0.0.1: ICMP echo reply, id 27352, seq 298, length 64
14:07:37.919395 IP 10.0.0.1 > 10.0.0.2: ICMP echo request, id 27352, seq 299, length 64
14:07:37.919407 IP 10.0.0.2 > 10.0.0.1: ICMP echo reply, id 27352, seq 299, length 64
14:07:37.919418 IP 10.0.0.2 > 10.0.0.1: ICMP echo reply, id 27352, seq 299, length 64
14:07:38.431362 LLDP, length 71: openflow:4
14:07:38.431454 LLDP, length 71: openflow:1
14:07:38.431505 LLDP, length 71: openflow:3
14:07:38.943394 IP 10.0.0.1 > 10.0.0.2: ICMP echo request, id 27352, seq 300, length 64
14:07:38.943407 IP 10.0.0.2 > 10.0.0.1: ICMP echo reply, id 27352, seq 300, length 64
14:07:38.943419 IP 10.0.0.2 > 10.0.0.1: ICMP echo reply, id 27352, seq 300, length 64
14:07:39.967420 IP 10.0.0.1 > 10.0.0.2: ICMP echo request, id 27352, seq 301, length 64
14:07:39.967434 IP 10.0.0.2 > 10.0.0.1: ICMP echo reply, id 27352, seq 301, length 64
14:07:39.967445 IP 10.0.0.2 > 10.0.0.1: ICMP echo reply, id 27352, seq 301, length 64
14:07:40.991457 IP 10.0.0.1 > 10.0.0.2: ICMP echo request, id 27352, seq 302, length 64
14:07:40.991470 IP 10.0.0.2 > 10.0.0.1: ICMP echo reply, id 27352, seq 302, length 64
14:07:40.991482 IP 10.0.0.2 > 10.0.0.1: ICMP echo reply, id 27352, seq 302, length 64
14:07:42.015449 IP 10.0.0.1 > 10.0.0.2: ICMP echo request, id 27352, seq 303, length 64
14:07:42.015461 IP 10.0.0.2 > 10.0.0.1: ICMP echo reply, id 27352, seq 303, length 64
14:07:42.015472 IP 10.0.0.2 > 10.0.0.1: ICMP echo reply, id 27352, seq 303, length 64
14:07:43.039410 IP 10.0.0.1 > 10.0.0.2: ICMP echo request, id 27352, seq 304, length 64
14:07:43.039427 IP 10.0.0.2 > 10.0.0.1: ICMP echo reply, id 27352, seq 304, length 64
14:07:43.039444 IP 10.0.0.2 > 10.0.0.1: ICMP echo reply, id 27352, seq 304, length 64
14:07:43.431423 LLDP, length 71: openflow:4
14:07:43.431518 LLDP, length 71: openflow:1
14:07:43.431573 LLDP, length 71: openflow:3
14:07:44.067390 IP 10.0.0.1 > 10.0.0.2: ICMP echo request, id 27352, seq 305, length 64
14:07:44.067407 IP 10.0.0.2 > 10.0.0.1: ICMP echo reply, id 27352, seq 305, length 64
14:07:44.067422 IP 10.0.0.2 > 10.0.0.1: ICMP echo reply, id 27352, seq 305, length 64
14:07:45.087396 IP 10.0.0.1 > 10.0.0.2: ICMP echo request, id 27352, seq 306, length 64
14:07:45.087411 IP 10.0.0.2 > 10.0.0.1: ICMP echo reply, id 27352, seq 306, length 64
14:07:45.087424 IP 10.0.0.2 > 10.0.0.1: ICMP echo reply, id 27352, seq 306, length 64
14:07:46.111417 IP 10.0.0.1 > 10.0.0.2: ICMP echo request, id 27352, seq 307, length 64
14:07:46.111430 IP 10.0.0.2 > 10.0.0.1: ICMP echo reply, id 27352, seq 307, length 64
14:07:46.111441 IP 10.0.0.2 > 10.0.0.1: ICMP echo reply, id 27352, seq 307, length 64
14:07:47.135441 IP 10.0.0.1 > 10.0.0.2: ICMP echo request, id 27352, seq 308, length 64
14:07:47.135467 IP 10.0.0.2 > 10.0.0.1: ICMP echo reply, id 27352, seq 308, length 64
14:07:47.135496 IP 10.0.0.2 > 10.0.0.1: ICMP echo reply, id 27352, seq 308, length 64
14:07:48.159422 IP 10.0.0.1 > 10.0.0.2: ICMP echo request, id 27352, seq 309, length 64
14:07:48.159436 IP 10.0.0.2 > 10.0.0.1: ICMP echo reply, id 27352, seq 309, length 64
14:07:48.159447 IP 10.0.0.2 > 10.0.0.1: ICMP echo reply, id 27352, seq 309, length 64
14:07:48.431411 LLDP, length 71: openflow:4
14:07:48.431501 LLDP, length 71: openflow:1
14:07:48.431559 LLDP, length 71: openflow:3
14:07:49.183412 IP 10.0.0.1 > 10.0.0.2: ICMP echo request, id 27352, seq 310, length 64
14:07:49.183431 IP 10.0.0.2 > 10.0.0.1: ICMP echo reply, id 27352, seq 310, length 64
14:07:49.183448 IP 10.0.0.2 > 10.0.0.1: ICMP echo reply, id 27352, seq 310, length 64
14:07:50.207402 IP 10.0.0.1 > 10.0.0.2: ICMP echo request, id 27352, seq 311, length 64
14:07:50.207418 IP 10.0.0.2 > 10.0.0.1: ICMP echo reply, id 27352, seq 311, length 64
14:07:50.207433 IP 10.0.0.2 > 10.0.0.1: ICMP echo reply, id 27352, seq 311, length 64
14:07:51.231422 IP 10.0.0.1 > 10.0.0.2: ICMP echo request, id 27352, seq 312, length 64
14:07:51.231436 IP 10.0.0.2 > 10.0.0.1: ICMP echo reply, id 27352, seq 312, length 64
14:07:51.231448 IP 10.0.0.2 > 10.0.0.1: ICMP echo reply, id 27352, seq 312, length 64
14:07:52.255421 IP 10.0.0.1 > 10.0.0.2: ICMP echo request, id 27352, seq 313, length 64
14:07:52.255434 IP 10.0.0.2 > 10.0.0.1: ICMP echo reply, id 27352, seq 313, length 64
14:07:52.255445 IP 10.0.0.2 > 10.0.0.1: ICMP echo reply, id 27352, seq 313, length 64
14:07:53.279452 IP 10.0.0.1 > 10.0.0.2: ICMP echo request, id 27352, seq 314, length 64
14:07:53.279465 IP 10.0.0.2 > 10.0.0.1: ICMP echo reply, id 27352, seq 314, length 64
14:07:53.279477 IP 10.0.0.2 > 10.0.0.1: ICMP echo reply, id 27352, seq 314, length 64
14:07:53.431305 LLDP, length 71: openflow:4
14:07:53.431347 LLDP, length 71: openflow:1
14:07:53.431391 LLDP, length 71: openflow:3
14:07:54.207392 ARP, Request who-has 10.0.0.1 tell 10.0.0.2, length 28
14:07:54.207620 ARP, Request who-has 10.0.0.1 tell 10.0.0.2, length 28
14:07:54.207650 ARP, Reply 10.0.0.1 is-at 00:00:00:00:00:01, length 28
14:07:54.303422 IP 10.0.0.1 > 10.0.0.2: ICMP echo request, id 27352, seq 315, length 64
14:07:54.303436 IP 10.0.0.2 > 10.0.0.1: ICMP echo reply, id 27352, seq 315, length 64
14:07:54.303447 IP 10.0.0.2 > 10.0.0.1: ICMP echo reply, id 27352, seq 315, length 64
14:07:55.327420 IP 10.0.0.1 > 10.0.0.2: ICMP echo request, id 27352, seq 316, length 64
14:07:55.327433 IP 10.0.0.2 > 10.0.0.1: ICMP echo reply, id 27352, seq 316, length 64
14:07:55.327445 IP 10.0.0.2 > 10.0.0.1: ICMP echo reply, id 27352, seq 316, length 64
14:07:56.351436 IP 10.0.0.1 > 10.0.0.2: ICMP echo request, id 27352, seq 317, length 64
14:07:56.351453 IP 10.0.0.2 > 10.0.0.1: ICMP echo reply, id 27352, seq 317, length 64
14:07:56.351467 IP 10.0.0.2 > 10.0.0.1: ICMP echo reply, id 27352, seq 317, length 64
14:07:57.375419 IP 10.0.0.1 > 10.0.0.2: ICMP echo request, id 27352, seq 318, length 64
14:07:57.375432 IP 10.0.0.2 > 10.0.0.1: ICMP echo reply, id 27352, seq 318, length 64
14:07:57.375445 IP 10.0.0.2 > 10.0.0.1: ICMP echo reply, id 27352, seq 318, length 64

