16:30:26.083411 IP 10.0.0.1 > 10.0.0.2: ICMP echo request, id 17467, seq 42, length 64
16:30:26.083431 IP 10.0.0.2 > 10.0.0.1: ICMP echo reply, id 17467, seq 42, length 64
16:30:27.103609 IP 10.0.0.1 > 10.0.0.2: ICMP echo request, id 17467, seq 43, length 64
16:30:27.103634 IP 10.0.0.2 > 10.0.0.1: ICMP echo reply, id 17467, seq 43, length 64
16:30:28.127504 IP 10.0.0.1 > 10.0.0.2: ICMP echo request, id 17467, seq 44, length 64
16:30:28.127530 IP 10.0.0.2 > 10.0.0.1: ICMP echo reply, id 17467, seq 44, length 64
16:30:29.151509 IP 10.0.0.1 > 10.0.0.2: ICMP echo request, id 17467, seq 45, length 64
16:30:29.151538 IP 10.0.0.2 > 10.0.0.1: ICMP echo reply, id 17467, seq 45, length 64
16:30:30.175443 IP 10.0.0.1 > 10.0.0.2: ICMP echo request, id 17467, seq 46, length 64
16:30:30.175469 IP 10.0.0.2 > 10.0.0.1: ICMP echo reply, id 17467, seq 46, length 64
16:30:31.199614 IP 10.0.0.1 > 10.0.0.2: ICMP echo request, id 17467, seq 47, length 64
16:30:31.199639 IP 10.0.0.2 > 10.0.0.1: ICMP echo reply, id 17467, seq 47, length 64
16:30:32.227509 IP 10.0.0.1 > 10.0.0.2: ICMP echo request, id 17467, seq 48, length 64
16:30:32.227535 IP 10.0.0.2 > 10.0.0.1: ICMP echo reply, id 17467, seq 48, length 64
16:30:33.247526 IP 10.0.0.1 > 10.0.0.2: ICMP echo request, id 17467, seq 49, length 64
16:30:33.247552 IP 10.0.0.2 > 10.0.0.1: ICMP echo reply, id 17467, seq 49, length 64
16:30:34.271509 IP 10.0.0.1 > 10.0.0.2: ICMP echo request, id 17467, seq 50, length 64
16:30:34.271537 IP 10.0.0.2 > 10.0.0.1: ICMP echo reply, id 17467, seq 50, length 64
16:30:35.295594 IP 10.0.0.1 > 10.0.0.2: ICMP echo request, id 17467, seq 51, length 64
16:30:35.295620 IP 10.0.0.2 > 10.0.0.1: ICMP echo reply, id 17467, seq 51, length 64
16:30:36.319612 IP 10.0.0.1 > 10.0.0.2: ICMP echo request, id 17467, seq 52, length 64
16:30:36.319638 IP 10.0.0.2 > 10.0.0.1: ICMP echo reply, id 17467, seq 52, length 64
16:30:37.343658 IP 10.0.0.1 > 10.0.0.2: ICMP echo request, id 17467, seq 53, length 64
16:30:37.343685 IP 10.0.0.2 > 10.0.0.1: ICMP echo reply, id 17467, seq 53, length 64
16:30:38.367512 IP 10.0.0.1 > 10.0.0.2: ICMP echo request, id 17467, seq 54, length 64
16:30:38.367539 IP 10.0.0.2 > 10.0.0.1: ICMP echo reply, id 17467, seq 54, length 64
16:30:39.391486 IP 10.0.0.1 > 10.0.0.2: ICMP echo request, id 17467, seq 55, length 64
16:30:39.391512 IP 10.0.0.2 > 10.0.0.1: ICMP echo reply, id 17467, seq 55, length 64
16:30:39.455366 ARP, Request who-has 10.0.0.1 tell 10.0.0.2, length 28
16:30:39.455576 ARP, Reply 10.0.0.1 is-at 00:00:00:00:00:01 (oui Ethernet), length 28
16:30:40.415582 IP 10.0.0.1 > 10.0.0.2: ICMP echo request, id 17467, seq 56, length 64
16:30:40.415608 IP 10.0.0.2 > 10.0.0.1: ICMP echo reply, id 17467, seq 56, length 64
16:30:41.439596 IP 10.0.0.1 > 10.0.0.2: ICMP echo request, id 17467, seq 57, length 64
16:30:41.439622 IP 10.0.0.2 > 10.0.0.1: ICMP echo reply, id 17467, seq 57, length 64
16:30:42.463613 IP 10.0.0.1 > 10.0.0.2: ICMP echo request, id 17467, seq 58, length 64
16:30:42.463638 IP 10.0.0.2 > 10.0.0.1: ICMP echo reply, id 17467, seq 58, length 64
16:30:43.487514 IP 10.0.0.1 > 10.0.0.2: ICMP echo request, id 17467, seq 59, length 64
16:30:43.487540 IP 10.0.0.2 > 10.0.0.1: ICMP echo reply, id 17467, seq 59, length 64
16:30:44.511586 IP 10.0.0.1 > 10.0.0.2: ICMP echo request, id 17467, seq 60, length 64
16:30:44.511612 IP 10.0.0.2 > 10.0.0.1: ICMP echo reply, id 17467, seq 60, length 64
16:30:45.535636 IP 10.0.0.1 > 10.0.0.2: ICMP echo request, id 17467, seq 61, length 64
16:30:45.535662 IP 10.0.0.2 > 10.0.0.1: ICMP echo reply, id 17467, seq 61, length 64
16:30:46.559634 IP 10.0.0.1 > 10.0.0.2: ICMP echo request, id 17467, seq 62, length 64
16:30:46.559661 IP 10.0.0.2 > 10.0.0.1: ICMP echo reply, id 17467, seq 62, length 64
16:30:47.583439 IP 10.0.0.1 > 10.0.0.2: ICMP echo request, id 17467, seq 63, length 64
16:30:47.583464 IP 10.0.0.2 > 10.0.0.1: ICMP echo reply, id 17467, seq 63, length 64
16:30:48.607509 IP 10.0.0.1 > 10.0.0.2: ICMP echo request, id 17467, seq 64, length 64
16:30:48.607534 IP 10.0.0.2 > 10.0.0.1: ICMP echo reply, id 17467, seq 64, length 64
16:30:49.631443 IP 10.0.0.1 > 10.0.0.2: ICMP echo request, id 17467, seq 65, length 64
16:30:49.631469 IP 10.0.0.2 > 10.0.0.1: ICMP echo reply, id 17467, seq 65, length 64
16:30:50.655620 IP 10.0.0.1 > 10.0.0.2: ICMP echo request, id 17467, seq 66, length 64
16:30:50.655646 IP 10.0.0.2 > 10.0.0.1: ICMP echo reply, id 17467, seq 66, length 64
16:30:51.679488 IP 10.0.0.1 > 10.0.0.2: ICMP echo request, id 17467, seq 67, length 64
16:30:51.679513 IP 10.0.0.2 > 10.0.0.1: ICMP echo reply, id 17467, seq 67, length 64
16:30:52.703578 IP 10.0.0.1 > 10.0.0.2: ICMP echo request, id 17467, seq 68, length 64
16:30:52.703603 IP 10.0.0.2 > 10.0.0.1: ICMP echo reply, id 17467, seq 68, length 64

