15:43:38.020257 IP 10.0.0.1 > 10.0.0.3: ICMP echo request, id 21133, seq 26, length 64
15:43:38.020293 IP 10.0.0.3 > 10.0.0.1: ICMP echo reply, id 21133, seq 26, length 64
15:43:39.044325 IP 10.0.0.1 > 10.0.0.3: ICMP echo request, id 21133, seq 27, length 64
15:43:39.044362 IP 10.0.0.3 > 10.0.0.1: ICMP echo reply, id 21133, seq 27, length 64
15:43:40.068327 IP 10.0.0.1 > 10.0.0.3: ICMP echo request, id 21133, seq 28, length 64
15:43:40.068364 IP 10.0.0.3 > 10.0.0.1: ICMP echo reply, id 21133, seq 28, length 64
15:43:41.092351 IP 10.0.0.1 > 10.0.0.3: ICMP echo request, id 21133, seq 29, length 64
15:43:41.092389 IP 10.0.0.3 > 10.0.0.1: ICMP echo reply, id 21133, seq 29, length 64
15:43:42.116214 IP 10.0.0.1 > 10.0.0.3: ICMP echo request, id 21133, seq 30, length 64
15:43:42.116251 IP 10.0.0.3 > 10.0.0.1: ICMP echo reply, id 21133, seq 30, length 64
15:43:43.140249 IP 10.0.0.1 > 10.0.0.3: ICMP echo request, id 21133, seq 31, length 64
15:43:43.140287 IP 10.0.0.3 > 10.0.0.1: ICMP echo reply, id 21133, seq 31, length 64
15:43:44.164338 IP 10.0.0.1 > 10.0.0.3: ICMP echo request, id 21133, seq 32, length 64
15:43:44.164375 IP 10.0.0.3 > 10.0.0.1: ICMP echo reply, id 21133, seq 32, length 64
15:43:45.188385 IP 10.0.0.1 > 10.0.0.3: ICMP echo request, id 21133, seq 33, length 64
15:43:45.188424 IP 10.0.0.3 > 10.0.0.1: ICMP echo reply, id 21133, seq 33, length 64
15:43:46.212380 IP 10.0.0.1 > 10.0.0.3: ICMP echo request, id 21133, seq 34, length 64
15:43:46.212417 IP 10.0.0.3 > 10.0.0.1: ICMP echo reply, id 21133, seq 34, length 64
15:43:46.212547 ARP, Request who-has 10.0.0.1 tell 10.0.0.3, length 28
15:43:46.212794 ARP, Reply 10.0.0.1 is-at 16:11:21:72:56:df, length 28
15:43:47.236254 IP 10.0.0.1 > 10.0.0.3: ICMP echo request, id 21133, seq 35, length 64
15:43:47.236292 IP 10.0.0.3 > 10.0.0.1: ICMP echo reply, id 21133, seq 35, length 64
15:43:48.260312 IP 10.0.0.1 > 10.0.0.3: ICMP echo request, id 21133, seq 36, length 64
15:43:48.260349 IP 10.0.0.3 > 10.0.0.1: ICMP echo reply, id 21133, seq 36, length 64
15:43:49.284240 IP 10.0.0.1 > 10.0.0.3: ICMP echo request, id 21133, seq 37, length 64
15:43:49.284277 IP 10.0.0.3 > 10.0.0.1: ICMP echo reply, id 21133, seq 37, length 64
15:43:50.308327 IP 10.0.0.1 > 10.0.0.3: ICMP echo request, id 21133, seq 38, length 64
15:43:50.308363 IP 10.0.0.3 > 10.0.0.1: ICMP echo reply, id 21133, seq 38, length 64
15:43:51.332264 IP 10.0.0.1 > 10.0.0.3: ICMP echo request, id 21133, seq 39, length 64
15:43:51.332302 IP 10.0.0.3 > 10.0.0.1: ICMP echo reply, id 21133, seq 39, length 64
15:43:52.356249 IP 10.0.0.1 > 10.0.0.3: ICMP echo request, id 21133, seq 40, length 64
15:43:52.356285 IP 10.0.0.3 > 10.0.0.1: ICMP echo reply, id 21133, seq 40, length 64
15:43:53.380366 IP 10.0.0.1 > 10.0.0.3: ICMP echo request, id 21133, seq 41, length 64
15:43:53.380402 IP 10.0.0.3 > 10.0.0.1: ICMP echo reply, id 21133, seq 41, length 64
15:43:54.404349 IP 10.0.0.1 > 10.0.0.3: ICMP echo request, id 21133, seq 42, length 64
15:43:54.404387 IP 10.0.0.3 > 10.0.0.1: ICMP echo reply, id 21133, seq 42, length 64
15:43:55.428258 IP 10.0.0.1 > 10.0.0.3: ICMP echo request, id 21133, seq 43, length 64
15:43:55.428299 IP 10.0.0.3 > 10.0.0.1: ICMP echo reply, id 21133, seq 43, length 64
15:43:56.452370 IP 10.0.0.1 > 10.0.0.3: ICMP echo request, id 21133, seq 44, length 64
15:43:56.452414 IP 10.0.0.3 > 10.0.0.1: ICMP echo reply, id 21133, seq 44, length 64
15:43:57.476215 IP 10.0.0.1 > 10.0.0.3: ICMP echo request, id 21133, seq 45, length 64
15:43:57.476251 IP 10.0.0.3 > 10.0.0.1: ICMP echo reply, id 21133, seq 45, length 64

